ObjektNr;Objektname;Baustelle;BaustPLZ;BaustOrt;BaustKanton;BaustBezirk;ReferenzNr;Kurzbeschreibung;Baustadium;BaustadiumDatum;BaustadiumAlt;BaustadiumDatumAlt;Baukosten;Baubeginn;Bauende;AnzWhg;Hauptkategorie;KatCode01;KatText01;KatCode02;KatText02;KatCode03;KatText03;KatCode04;KatText04;KatCode05;KatText05;KatCode06;KatText06;KatCode07;KatText07;KatCode08;KatText08;KatCode09;KatText09;KatCode10;KatText10
3251699;Fassaden- und Dachsanierung Einfamilienhaus;Kaustrasse 152;9050;Appenzell;AI;Appenzell I.Rh.;Parz. 538;Fassaden- und Dachsanierung Einfamilienhaus (L-Zone);Baubewilligung erteilt;19.12.2023;Baugesuch eingereicht;10.10.2023;0.20 Mio CHF;;;1;Wohnen (bis 2 Wohneinheiten);111;Einfamilienhäuser;;;;;;;;;;;;;;;;;;
3251759;Ersatzneubau Wohnhaus;Raffholdern 50;8722;Kaltbrunn;SG;See-Gaster;Parz. 1521;Ersatzneubau Wohnhaus;Baubewilligung erteilt;30.08.2024;Baugesuch eingereicht;10.10.2023;0.60 Mio CHF;;;1;Wohnen (bis 2 Wohneinheiten);111;Einfamilienhäuser;;;;;;;;;;;;;;;;;;
3251760;Neubau Einfamilienhaus mit Doppelgarage;Langweidstrasse 20;8722;Kaltbrunn;SG;See-Gaster;Parz.1540;Neubau Einfamilienhaus mit Doppelgarage;Baubewilligung erteilt;01.02.2024;Baugesuch eingereicht;10.10.2023;0.80-1.00 Mio CHF;;;1;Wohnen (bis 2 Wohneinheiten);111;Einfamilienhäuser;1313;Garagen / Fertiggaragen;;;;;;;;;;;;;;;;
3251762;Neubau Einfamilienhaus mit angebauter Doppelgarage;Langweidstrasse 22;8722;Kaltbrunn;SG;See-Gaster;Parz. 1541;Neubau Einfamilienhaus mit angebauter Doppelgarage;Baubewilligung erteilt;07.03.2024;Baugesuch eingereicht;10.10.2023;0.70 Mio CHF;Mär 24;Mär 25;1;Wohnen (bis 2 Wohneinheiten);111;Einfamilienhäuser;1313;Garagen / Fertiggaragen;;;;;;;;;;;;;;;;
3251764;Sanierung Gebäudehülle und Ersatz Fenster bei Einfamilienhaus;Sandbüelstrasse 26;9122;Mogelsberg;SG;Toggenburg;Parz. 1426;Sanierung Gebäudehülle und Ersatz Fenster bei Einfamilienhaus;Baubewilligung erteilt;08.12.2023;Baugesuch eingereicht;10.10.2023;0.06 Mio CHF;Frühling 2024;;1;Wohnen (bis 2 Wohneinheiten);111;Einfamilienhäuser;111;Einfamilienhäuser;;;;;;;;;;;;;;;;
3251765;Umbau Einfamilienhaus;Evabrunnen 668;9651;Ennetbühl;SG;Toggenburg;Parz. 782;Umbau Einfamilienhaus;Baubewilligung erteilt;15.03.2024;Baugesuch eingereicht;10.10.2023;0.90 Mio CHF;;;1;Wohnen (bis 2 Wohneinheiten);111;Einfamilienhäuser;;;;;;;;;;;;;;;;;;
3251766;Neubau Wohnhaus mit Garage;Mülistrasse;9655;Stein SG;SG;Toggenburg;Parz. 351;Neubau Wohnhaus mit Garage;Baubewilligung erteilt;16.11.2023;Baugesuch eingereicht;10.10.2023;0.55 Mio CHF;;;1;Wohnen (bis 2 Wohneinheiten);111;Einfamilienhäuser;1313;Garagen / Fertiggaragen;;;;;;;;;;;;;;;;
3251958;Sanierung Fassade und Dach inkl. Dachkonstruktion bei Einfamilienhaus;Rüti Dorf 2635;8718;Schänis;SG;See-Gaster;Parz. 269;Sanierung Fassade und Dach inkl. Dachkonstruktion bei Einfamilienhaus (L-Zone);Baubewilligung erteilt;07.03.2024;Baugesuch eingereicht;11.10.2023;0.07 Mio CHF;;;1;Wohnen (bis 2 Wohneinheiten);111;Einfamilienhäuser;;;;;;;;;;;;;;;;;;
3251959;Umbau und Erweiterung Einfamilienhaus;Hintere Rosenstrasse 11;7323;Wangs;SG;Sarganserland;Parz. 246;Umbau und Erweiterung Einfamilienhaus;Baubewilligung erteilt;22.01.2024;Baugesuch eingereicht;11.10.2023;0.50 Mio CHF;Jan 24;Sep 24;1;Wohnen (bis 2 Wohneinheiten);111;Einfamilienhäuser;111;Einfamilienhäuser;410;Schuppen und Hütten;;;;;;;;;;;;;;
3252250;Neubau Einfamilienhaus und integrierte Garage;Kirchstrasse 3a;9524;Zuzwil SG;SG;Wil;Parz. 990;Neubau Einfamilienhaus und integrierte Garage;Baubewilligung erteilt;12.12.2023;Baugesuch eingereicht;12.10.2023;1.20 Mio CHF;ca. Sommer 2024;Frühling/Sommer 2025;1;Wohnen (bis 2 Wohneinheiten);111;Einfamilienhäuser;;;;;;;;;;;;;;;;;;
3252254;Umbau Einfamilienhaus;Mattenhof 28;9305;Berg SG;SG;Rorschach;Parz. 384;Umbau Einfamilienhaus;Baubewilligung erteilt;16.11.2023;Baugesuch eingereicht;12.10.2023;0.30 Mio CHF;;;1;Wohnen (bis 2 Wohneinheiten);111;Einfamilienhäuser;111;Einfamilienhäuser;;;;;;;;;;;;;;;;
3252258;Neubau Einfamilienhaus mit kleine Tiefgarage;Alte Strasse 11;9606;Bütschwil;SG;Toggenburg;Parz. 194, 1043;Neubau Einfamilienhaus mit kleine Tiefgarage;Baubewilligung erteilt;29.04.2024;Baugesuch eingereicht;12.10.2023;1.00 Mio CHF;Jul 24;Feb 25;1;Wohnen (bis 2 Wohneinheiten);111;Einfamilienhäuser;1312;Tiefgaragen und Unterniveaugaragen;;;;;;;;;;;;;;;;
3252260;Neubau Einfamilienhaus;Taa;9606;Bütschwil;SG;Toggenburg;Parz. 777;Neubau Einfamilienhaus (Korrektureingabe);Baubewilligung erteilt;06.11.2024;Baugesuch eingereicht;12.10.2023;0.70 Mio CHF;;;1;Wohnen (bis 2 Wohneinheiten);111;Einfamilienhäuser;;;;;;;;;;;;;;;;;;
3252263;Dachverlängerung und Einbau Dachlukarne bei Einfamilienhaus;Schulhausstrasse 6;7317;Valens;SG;Sarganserland;Parz. 1387;Dachverlängerung und Einbau Dachlukarne bei Einfamilienhaus;Baubewilligung erteilt;15.11.2023;Baugesuch eingereicht;12.10.2023;0.15 Mio CHF;Frühling 2024;;1;Wohnen (bis 2 Wohneinheiten);111;Einfamilienhäuser;111;Einfamilienhäuser;;;;;;;;;;;;;;;;
3252264;Sanierung Dach mit Aufsparrendämmumg bei Einfamilienhaus;Staatsstrasse 69;9464;Rüthi (Rheintal);SG;Rheintal;Parz. 61;Sanierung Dach mit Aufsparrendämmumg bei Einfamilienhaus;Baubewilligung erteilt;16.11.2023;Baugesuch eingereicht;12.10.2023;0.06 Mio CHF;;;1;Wohnen (bis 2 Wohneinheiten);111;Einfamilienhäuser;;;;;;;;;;;;;;;;;;
3252268;Neubau Doppeleinfamilienhausteil/Haus A mit Garage;Seilereistrasse;8892;Berschis;SG;Sarganserland;Parz. 2827;Neubau Doppeleinfamilienhausteil/Haus A mit Garage;Baubewilligung erteilt;05.12.2023;Baugesuch eingereicht;12.10.2023;0.70 Mio CHF;;;1;Wohnen (bis 2 Wohneinheiten);111;Einfamilienhäuser;1313;Garagen / Fertiggaragen;;;;;;;;;;;;;;;;
3252269;Neubau Doppeleinfamilienhausteil/Haus B mit Garage;Seilereistrasse;8892;Berschis;SG;Sarganserland;Parz. 413;Neubau Doppeleinfamilienhausteil/Haus B mit Garage;Baubewilligung erteilt;05.12.2023;Baugesuch eingereicht;12.10.2023;0.60 Mio CHF;;;1;Wohnen (bis 2 Wohneinheiten);111;Einfamilienhäuser;1313;Garagen / Fertiggaragen;;;;;;;;;;;;;;;;
3252707;Neubau Einfamilienhaus mit integrierter Garage;;8717;Benken SG;SG;See-Gaster;Parz. 842;Neubau Einfamilienhaus mit integrierter Garage;Baubewilligung erteilt;10.05.2024;Baugesuch eingereicht;13.10.2023;0.80-0.90 Mio CHF;;;1;Wohnen (bis 2 Wohneinheiten);111;Einfamilienhäuser;;;;;;;;;;;;;;;;;;
3253110;Umbau und Erweiterung Einfamilienhaus;Grämigen 398;9601;Lütisburg Station;SG;Toggenburg;Parz. 564;Umbau und Erweiterung Einfamilienhaus (Unternehmer bestimmt);Baubewilligung erteilt;13.12.2023;Baugesuch eingereicht;17.10.2023;0.25 Mio CHF;Mitte Dezember 2023;;1;Wohnen (bis 2 Wohneinheiten);111;Einfamilienhäuser;111;Einfamilienhäuser;;;;;;;;;;;;;;;;
3253116;Neubau Einfamilienhaus und integrierte Garage;Sonnhaldenstrasse 55;8722;Kaltbrunn;SG;See-Gaster;Parz. 1637;Neubau Einfamilienhaus und integrierte Garage;Baubewilligung erteilt;04.12.2023;Baugesuch eingereicht;17.10.2023;0.70-0.80 Mio CHF;Februar / März 2024;Jul 25;1;Wohnen (bis 2 Wohneinheiten);111;Einfamilienhäuser;;;;;;;;;;;;;;;;;;
3253309;Neubau Einfamilienhaus mit Garage;Rietstrasse 4a;9435;Heerbrugg;SG;Rheintal;Parz. 745;Neubau Einfamilienhaus mit Garage und Aussenpool;Baubewilligung erteilt;24.11.2023;Baugesuch eingereicht;18.10.2023;0.80-1.00 Mio CHF;;;1;Wohnen (ab 3 Wohneinheiten);111;Einfamilienhäuser;1231;Swimmingpools, Jacuzzi;1313;Garagen / Fertiggaragen;;;;;;;;;;;;;;
3253310;Anbau Wohnung und Photovoltaikanlage auf Dach;Neumüliweg 8;9473;Gams;SG;Werdenberg;Parz. 1643;Anbau Wohnung und Photovoltaikanlage auf Dach;Baubewilligung erteilt;24.01.2024;Baugesuch eingereicht;18.10.2023;0.40-0.50 Mio CHF;;;1;Wohnen (bis 2 Wohneinheiten);111;Einfamilienhäuser;111;Einfamilienhäuser;;;;;;;;;;;;;;;;
3253457;Wärmetechnische Sanierung Dach und Fassade bei Einfamilienhaus;Rumple;8890;Flums;SG;Sarganserland;Parz. 3448;Wärmetechnische Sanierung Dach und Fassade bei Einfamilienhaus;Baubewilligung erteilt;15.02.2024;Baugesuch eingereicht;19.10.2023;0.03 Mio CHF;;;1;Wohnen (bis 2 Wohneinheiten);111;Einfamilienhäuser;111;Einfamilienhäuser;;;;;;;;;;;;;;;;
3253462;Umbau und Sanierung Einfamilienhaus;Dörflistrasse 21;9658;Wildhaus;SG;Toggenburg;Parz. 17;Umbau und Sanierung Einfamilienhaus (L-Zone);Baubewilligung erteilt;13.03.2024;Baugesuch eingereicht;20.10.2023;0.30 Mio CHF;;;1;Wohnen (bis 2 Wohneinheiten);111;Einfamilienhäuser;111;Einfamilienhäuser;;;;;;;;;;;;;;;;
3253868;Einbau Wohnung in Scheune;Künggass 8;9425;Thal;SG;Rorschach;Parz. 1084;Einbau Wohnung in Scheune (Unternehmer bestimmt);Baubewilligung erteilt;15.02.2024;Baugesuch eingereicht;20.10.2023;0.30 Mio CHF;;;1;Wohnen (bis 2 Wohneinheiten);116;Wohnungen;116;Wohnungen;;;;;;;;;;;;;;;;
3253879;Neubau Einfamilienhaus mit Doppelgarage und Schwimmteich;Kirchweg 5a;9434;Au SG;SG;Rheintal;Parz. 348;Neubau Einfamilienhaus mit Doppelgarage und Schwimmteich;Baubewilligung erteilt;15.02.2024;Baugesuch eingereicht;20.10.2023;1.20-1.30 Mio CHF;;;1;Wohnen (bis 2 Wohneinheiten);111;Einfamilienhäuser;1231;Swimmingpools, Jacuzzi;1313;Garagen / Fertiggaragen;;;;;;;;;;;;;;
3253880;Gesamtsanierung mit Dachaufstockung Einfamilienhau;Mühlefeldstrasse 14;9113;Degersheim;SG;Wil;Parz. 111;Gesamtsanierung mit Dachaufstockung Einfamilienhaus (Unternehmer bestimmt/wünschen keine Offertanfragen);Baubewilligung erteilt;04.10.2024;Baugesuch eingereicht;20.10.2023;0.50 Mio CHF;;;1;Wohnen (bis 2 Wohneinheiten);111;Einfamilienhäuser;111;Einfamilienhäuser;111;Einfamilienhäuser;;;;;;;;;;;;;;
3253887;Erweiterung Einfamilienhaus;Bürgistrasse 12;9620;Lichtensteig;SG;Toggenburg;Parz. 405, 406;Erweiterung Einfamilienhaus;Baubewilligung erteilt;08.12.2023;Baugesuch eingereicht;20.10.2023;0.32 Mio CHF;;;1;Wohnen (bis 2 Wohneinheiten);111;Einfamilienhäuser;;;;;;;;;;;;;;;;;;
3253890;Neubau Einfamilienhaus mit angebauter Garage;Tiergartenweg 11;9470;Buchs SG;SG;Werdenberg;Parz. 1740;Neubau Einfamilienhaus mit angebauter Garage;Baubewilligung erteilt;22.11.2023;Baugesuch eingereicht;20.10.2023;0.95 Mio CHF;Frühling 224;Dez 24;1;Wohnen (bis 2 Wohneinheiten);111;Einfamilienhäuser;1313;Garagen / Fertiggaragen;;;;;;;;;;;;;;;;
3254010;Umbau und Sanierung Ferienhaus;Grund;9044;Wald AR;AR;Vorderland;Parz. 567;Umbau und Sanierung Ferienhaus mit Wohnraumerweiterung (L-Zone);Baubewilligung erteilt;12.02.2024;Baugesuch eingereicht;20.10.2023;0.40 Mio CHF;;;1;Wohnen (bis 2 Wohneinheiten);113;Ferienhäuser;113;Ferienhäuser;;;;;;;;;;;;;;;;
3254012;Wiederaufbau Einfamilienhaus;Oberer Rickenbach;9411;Schachen b. Reute;AR;Vorderland;Parz. 202;Wiederaufbau Einfamilienhaus (Unternehmer bestimmt);Baubewilligung erteilt;05.03.2024;Baugesuch eingereicht;20.10.2023;0.90 Mio CHF;;;1;Wohnen (bis 2 Wohneinheiten);111;Einfamilienhäuser;;;;;;;;;;;;;;;;;;
3254565;Neubau Einfamilienhaus mit Garage;Emserenstrasse 39;9434;Au SG;SG;Rheintal;Parz. 1980;Neubau Einfamilienhaus mit Garage;Baubewilligung erteilt;13.05.2024;Baugesuch eingereicht;24.10.2023;0.80 Mio CHF;;;1;Wohnen (bis 2 Wohneinheiten);111;Einfamilienhäuser;1313;Garagen / Fertiggaragen;;;;;;;;;;;;;;;;
3254770;Neubau Einfamilienhaus;Austrasse 1;9057;Weissbad;AI;Appenzell I.Rh.;Parz. 476;Neubau Einfamilienhaus;Baubewilligung erteilt;09.01.2024;Baugesuch eingereicht;25.10.2023;0.90 Mio CHF;;;1;Wohnen (bis 2 Wohneinheiten);111;Einfamilienhäuser;;;;;;;;;;;;;;;;;;
3254775;Umbau Einfamilienhaus;Aulenstrasse 19 / Gehr;9058;Brülisau;AI;Appenzell I.Rh.;Parz. 568;Umbau und Umnutzung im Anbau beim Einfamilienhaus und Erstellen einer Kleinkläranlage (L-Zone);Baubewilligung erteilt;09.01.2024;Baugesuch eingereicht;25.10.2023;0.35 Mio CHF;;;1;Wohnen (bis 2 Wohneinheiten);111;Einfamilienhäuser;5120;Biologische und chemische Abwasserreinigungsanlagen;;;;;;;;;;;;;;;;
3254792;Einbau Wohnung in Scheune;Winkelstrasse 20;9445;Rebstein;SG;Rheintal;Gst. 916;Einbau Wohnung in Scheune;Baubewilligung erteilt;21.03.2024;Baugesuch eingereicht;25.10.2023;0.40 Mio CHF;;;1;Wohnen (bis 2 Wohneinheiten);111;Einfamilienhäuser;116;Wohnungen;;;;;;;;;;;;;;;;
3254798;Neubau Einfamilienhaus;Trogenerstrasse 74;9450;Altstätten SG;SG;Rheintal;Gst. 6605;Neubau Einfamilienhaus;Baubewilligung erteilt;06.02.2024;Baugesuch eingereicht;25.10.2023;1.10 Mio CHF;;;1;Wohnen (bis 2 Wohneinheiten);111;Einfamilienhäuser;;;;;;;;;;;;;;;;;;
3254801;Umbau und Erweiterung Einfamilienhaus;Güetlistrasse 1;9400;Rorschach;SG;Rorschach;Gst. 1987;Umbau und Erweiterung Einfamilienhaus. Unternehmer bestimmt.;Baubewilligung erteilt;16.01.2024;Baugesuch eingereicht;13.11.2023;0.60 Mio CHF;;;1;Wohnen (bis 2 Wohneinheiten);111;Einfamilienhäuser;111;Einfamilienhäuser;;;;;;;;;;;;;;;;
3255308;Wiederaufbau Einfamilienhaus;Grämigen;9601;Lütisburg Station;SG;Toggenburg;Gst. 541;Wiederaufbau Einfamilienhaus mit Carport;Baubewilligung erteilt;24.09.2024;Baugesuch eingereicht;27.10.2023;0.80 Mio CHF;Frühling 2025;Mär 26;1;Wohnen (bis 2 Wohneinheiten);111;Einfamilienhäuser;1314;Carports und Abstellplätze;;;;;;;;;;;;;;;;
3255314;Erweiterung Halle;Herbergstrasse 16;9524;Zuzwil SG;SG;Wil;GS 155;Erweiterung Halle;Baubewilligung erteilt;17.02.2024;Baugesuch eingereicht;27.10.2023;0.30 Mio CHF;;;1;Industrie und Gewerbe;310;Lagerhallen;;;;;;;;;;;;;;;;;;
3255325;Neubau Einfamilienhaus mit Doppelgarage;Hültschweg15c;9473;Gams;SG;Werdenberg;Parz, 2291;Neubau Einfamilienhaus mit Doppelgarage;Baubewilligung erteilt;31.01.2024;Baugesuch eingereicht;14.11.2023;0.95 Mio CHF;Apr 24;Nov 24;1;Wohnen (bis 2 Wohneinheiten);111;Einfamilienhäuser;1313;Garagen / Fertiggaragen;;;;;;;;;;;;;;;;
3255344;Neubau Einfamilienhaus mit angebauter Garage;Mühletobelstrasse;9400;Rorschach;SG;Rorschach;Gst. 2313;Neubau Einfamilienhaus mit angebauter Garage;Baubewilligung erteilt;01.02.2024;Baugesuch eingereicht;02.11.2023;1.10 Mio CHF;;;1;Wohnen (bis 2 Wohneinheiten);111;Einfamilienhäuser;1313;Garagen / Fertiggaragen;;;;;;;;;;;;;;;;
3255351;Neubau Einfamilienhaus mit Carport;Leeweg;8880;Walenstadt;SG;Sarganserland;Gst. 2822;Neubau Einfamilienhaus mit Carport;Baubewilligung erteilt;05.12.2023;Baugesuch eingereicht;26.10.2023;0.80 Mio CHF;Mär 24;Dez 24;1;Wohnen (bis 2 Wohneinheiten);111;Einfamilienhäuser;1314;Carports und Abstellplätze;;;;;;;;;;;;;;;;
3255356;Erweiterung Einfamilienhaus;Gafadurastrasse 49;8884;Oberterzen;SG;Sarganserland;Gst. 2039;Erweiterung Einfamilienhaus;Baubewilligung erteilt;25.05.2024;Baugesuch eingereicht;18.10.2023;0.20-0.40 Mio CHF;;;1;Wohnen (bis 2 Wohneinheiten);111;Einfamilienhäuser;;;;;;;;;;;;;;;;;;
3255359;An- und Umbau Einfamilienhaus;Kiesgrube 587;9658;Wildhaus;SG;Toggenburg;Gst. 2643;An- und Umbau Einfamilienhaus;Baubewilligung erteilt;19.04.2024;Baugesuch eingereicht;20.10.2023;0.20 Mio CHF;;;1;Wohnen (bis 2 Wohneinheiten);111;Einfamilienhäuser;111;Einfamilienhäuser;;;;;;;;;;;;;;;;
3255914;Sanierung Einfamilienhaus und Anbau gedeckter Sitzplatz;Widenbachstrasse 1;9452;Hinterforst;SG;Rheintal;Parz. 5084;Sanierung Einfamilienhaus und Anbau gedeckter Sitzplatz;Baubewilligung erteilt;05.12.2023;Baugesuch eingereicht;30.10.2023;0.20 Mio CHF;;;1;Wohnen (bis 2 Wohneinheiten);111;Einfamilienhäuser;111;Einfamilienhäuser;;;;;;;;;;;;;;;;
3256103;Umnutzung Büro- und Austellungsraum in Wohnung;Mühlackerweg 9;9450;Altstätten SG;SG;Rheintal;Parz. 476;Umnutzung Büro- und Austellungsraum in Wohnung;Baubewilligung erteilt;10.01.2024;Baugesuch eingereicht;31.10.2023;0.20 Mio CHF;;;1;Wohnen (bis 2 Wohneinheiten);116;Wohnungen;116;Wohnungen;116;Wohnungen;;;;;;;;;;;;;;
3256105;Umbau / Erweiterung Einfamilienhaus;Feldweg 2;8890;Flums;SG;Sarganserland;Parz. 2011;Umbau / Erweiterung Einfamilienhaus;Baubewilligung erteilt;04.12.2023;Baugesuch eingereicht;31.10.2023;0.45 Mio CHF;Februar / März 2024;;1;Wohnen (bis 2 Wohneinheiten);111;Einfamilienhäuser;111;Einfamilienhäuser;;;;;;;;;;;;;;;;
3256109;Umbau eines Einfamilienhauses;Werdenstrasse 27;9472;Grabs;SG;Werdenberg;Parz. 1440;Umbau Einfamilienhaus;Baubewilligung erteilt;08.12.2023;Baugesuch eingereicht;31.10.2023;0.35 Mio CHF;;;1;Wohnen (bis 2 Wohneinheiten);111;Einfamilienhäuser;;;;;;;;;;;;;;;;;;
3256112;Anbau Einliegerwohnung und Hobbyraum;Weidlistrasse 43;9607;Mosnang;SG;Toggenburg;Parz. 2097;Anbau Einliegerwohnung und Hobbyraum, Neubau Gartenhaus;Baubewilligung erteilt;15.02.2024;Baugesuch eingereicht;31.10.2023;0.30 Mio CHF;Jun 24;Dez 24;1;Wohnen (bis 2 Wohneinheiten);111;Einfamilienhäuser;411;Gartenhäuser / Pavillons;1231;Swimmingpools, Jacuzzi;;;;;;;;;;;;;;
3256114;Anbau Abstellraum, Umnutzung Garagen in Einliegerwohnung;Briggla 14;9475;Sevelen;SG;Werdenberg;Parz. 2687;Anbau Abstellraum, Umnutzung Garagen in Einliegerwohnung;Baubewilligung erteilt;18.12.2023;Baugesuch eingereicht;31.10.2023;0.20 Mio CHF;;;1;Wohnen (bis 2 Wohneinheiten);116;Wohnungen;410;Schuppen und Hütten;;;;;;;;;;;;;;;;
3256412;Umbau Einfamilienhaus und Teilausbau Stallteil;Brogers 5, 5a;9050;Appenzell Meistersrüte;AI;Appenzell I.Rh.;Parz. 775;Sanierung/Umbau Einfamilienhaus und Teilausbau Stallteil zu Wohnzwecken (L-Zone);Baubewilligung erteilt;30.01.2024;Baugesuch eingereicht;02.11.2023;0.90 Mio CHF;;;1;Wohnen (bis 2 Wohneinheiten);111;Einfamilienhäuser;111;Einfamilienhäuser;430;Stallungen und landwirtschaftliche Produktionsanlagen;;;;;;;;;;;;;;
3256445;Neubau Einfamilienhaus und angebaute Doppelgarage;Burgstrasse 13;9434;Au SG;SG;Rheintal;Parz. 2410;Neubau Einfamilienhaus und angebaute Doppelgarage;Baubewilligung erteilt;02.05.2024;Baugesuch eingereicht;02.11.2023;1.70 Mio CHF;;;1;Wohnen (bis 2 Wohneinheiten);111;Einfamilienhäuser;1313;Garagen / Fertiggaragen;;;;;;;;;;;;;;;;
3256449;Umbau und Sanierung best. Einfamilienhaus;Alte Landstrasse 4;9442;Berneck;SG;Rheintal;Parz. 314;Umbau und Sanierung best. Einfamilienhaus;Baubewilligung erteilt;12.04.2024;Baugesuch eingereicht;02.11.2023;0.50 Mio CHF;Apr 24;Okt 24;1;Wohnen (bis 2 Wohneinheiten);111;Einfamilienhäuser;111;Einfamilienhäuser;;;;;;;;;;;;;;;;
3256453;Innenrenovation Einfamilienhaus und Anbau Carport;Zäpfehusstrasse 15a;9602;Bazenheid;SG;Toggenburg;Parz. 418;Innenrenovation Einfamilienhaus und Anbau Carport (Unternehmer bestimmt/wünschen keine Offertanfragen);Baubewilligung erteilt;06.04.2024;Baugesuch eingereicht;02.11.2023;0.35 Mio CHF;;;1;Wohnen (bis 2 Wohneinheiten);111;Einfamilienhäuser;1314;Carports und Abstellplätze;;;;;;;;;;;;;;;;
3256456;Umbau und Sanierung Einfamilienhaus;Müselbacherstrasse 10;9602;Bazenheid;SG;Toggenburg;Parz. 439;Umbau und Sanierung Einfamilienhaus;Baubewilligung erteilt;02.03.2024;Baugesuch eingereicht;02.11.2023;0.07 Mio CHF;;;1;Wohnen (bis 2 Wohneinheiten);111;Einfamilienhäuser;111;Einfamilienhäuser;;;;;;;;;;;;;;;;
3256460;Umbau und Sanierung Einfamilienhaus;Büntstrasse 17;8725;Gebertingen;SG;See-Gaster;Parz. 585;Umbau und Sanierung Einfamilienhaus;Baubewilligung erteilt;23.01.2024;Baugesuch eingereicht;02.11.2023;0.20-0.40 Mio CHF;;;1;Wohnen (bis 2 Wohneinheiten);111;Einfamilienhäuser;111;Einfamilienhäuser;;;;;;;;;;;;;;;;
3256772;Neubau Einfamilienhaus und integrierte Garage;Donnerstrasse;9450;Altstätten SG;SG;Rheintal;Parz. 6156;Neubau Einfamilienhaus und integrierte Garage;Baubewilligung erteilt;14.12.2023;Baugesuch eingereicht;03.11.2023;0.90 Mio CHF;;;1;Wohnen (bis 2 Wohneinheiten);111;Einfamilienhäuser;;;;;;;;;;;;;;;;;;
3256778;Sanierung Dach bei Einfamilienhaus;Rorschacherstrasse 51;9450;Altstätten SG;SG;Rheintal;Parz. 1195;Sanierung Dach bei Einfamilienhaus;Baubewilligung erteilt;22.01.2024;Baugesuch eingereicht;03.11.2023;0.10 Mio CHF;Jan 24;Mär 24;1;Wohnen (bis 2 Wohneinheiten);111;Einfamilienhäuser;;;;;;;;;;;;;;;;;;
3256791;Energetische Dach- und Fassadesanierung bei Einfamilienhaus;Weidstrasse 17;9230;Flawil;SG;Wil;Parz. 2018;Energetische Dach- und Fassadesanierung bei Einfamilienhaus (Unternehmer bestimmt);Baubewilligung erteilt;09.01.2024;Baugesuch eingereicht;03.11.2023;0.05-0.06 Mio CHF;;;1;Wohnen (bis 2 Wohneinheiten);111;Einfamilienhäuser;;;;;;;;;;;;;;;;;;
3256805;Umbau ehemaliges Schulhaus in Einfamilienhaus;Niederglatt 1496;9240;Niederglatt SG;SG;Wil;Parz. 2653;Umbau ehemaliges Schulhaus in Einfamilienhaus, Neubau Autounterstand;Baubewilligung erteilt;29.08.2024;Baugesuch eingereicht;03.11.2023;0.30 Mio CHF;;;1;Unterricht, Bildung und Forschung;111;Einfamilienhäuser;111;Einfamilienhäuser;1314;Carports und Abstellplätze;;;;;;;;;;;;;;
3257206;Instandstellung Dachlandschaft, Dacherhöhung bei Einfamilienhaus, Ersatzbau Garage;Trogenerstrasse 6;9450;Altstätten SG;SG;Rheintal;Parz. 349;Instandstellung Dachlandschaft, Dacherhöhung bei Einfamilienhaus, Ersatzbau Garage;Baubewilligung erteilt;05.12.2023;Baugesuch eingereicht;06.11.2023;0.20 Mio CHF;;;1;Wohnen (bis 2 Wohneinheiten);111;Einfamilienhäuser;111;Einfamilienhäuser;1313;Garagen / Fertiggaragen;;;;;;;;;;;;;;
3257207;Energetische Dachsanierung und Fassadensanierung bei Einfamilienhaus;Feldwiesenstrasse 53;9450;Lüchingen;SG;Rheintal;Parz. 4862;Energetische Dachsanierung und Fassadensanierung bei Einfamilienhaus;Baubewilligung erteilt;05.12.2023;Baugesuch eingereicht;06.11.2023;0.09 Mio CHF;;;1;Wohnen (bis 2 Wohneinheiten);111;Einfamilienhäuser;111;Einfamilienhäuser;;;;;;;;;;;;;;;;
3257212;Einbau Wohnung und Aufhebung Schutzraum;Underheligchrüz;8887;Mels;SG;Sarganserland;Parz. 1722;Einbau Wohnung und Aufhebung Schutzraum;Baubewilligung erteilt;29.01.2024;Baugesuch eingereicht;06.11.2023;0.10 Mio CHF;;;1;Wohnen (bis 2 Wohneinheiten);111;Einfamilienhäuser;;;;;;;;;;;;;;;;;;
3257213;Renovation und Umbau Villa Meienberg;Meienbergstrasse 40;8645;Jona;SG;See-Gaster;Gst. 2651;Renovation und Umbau Villa Meienberg;Baubewilligung erteilt;22.07.2024;Baugesuch eingereicht;06.11.2023;4.50 Mio CHF;;;1;Wohnen (bis 2 Wohneinheiten);111;Einfamilienhäuser;111;Einfamilienhäuser;;;;;;;;;;;;;;;;
3257217;Neubau Einfamilienhaus mit integrierter Garage (Hanglage);Rebhalde 27;8645;Jona;SG;See-Gaster;Parz. 2352;Neubau Einfamilienhaus mit integrierter Garage (Hanglage);Baubewilligung erteilt;13.06.2024;Baugesuch eingereicht;06.11.2023;3.70 Mio CHF;Okt 24;Nov 25;1;Wohnen (bis 2 Wohneinheiten);111;Einfamilienhäuser;;;;;;;;;;;;;;;;;;
3257407;Sanierung Ostfassade bei Einfamilienhaus;Niederhufen-Bühl 296;9650;Nesslau;SG;Toggenburg;Parz. 739;Sanierung Ostfassade bei Einfamilienhaus (Unternehmer bestimmt);Baubewilligung erteilt;27.02.2024;Baugesuch eingereicht;07.11.2023;0.02 Mio CHF;;;1;Wohnen (bis 2 Wohneinheiten);111;Einfamilienhäuser;;;;;;;;;;;;;;;;;;
3257541;Neubau Sommerstall und Jauchegrube;Seuzach-Laad 1376;9650;Nesslau;SG;Toggenburg;Parz. 413;Neubau Sommerstall und Jauchegrube, Verbreitung Zufahrtstrasse;Baubewilligung erteilt;06.02.2024;Baugesuch eingereicht;08.11.2023;0.40 Mio CHF;;;1;Land- und Forstwirtschaft;430;Stallungen und landwirtschaftliche Produktionsanlagen;480;Jauchegrube;2110;Strassen;;;;;;;;;;;;;;
3257702;Neubau Einfamilienhaus mit Garage und Remise;Wäldi 176;9308;Lömmenschwil;SG;St. Gallen;Parz. 194;Neubau Einfamilienhaus mit Garage und Remise;Baubewilligung erteilt;13.03.2024;Baugesuch eingereicht;09.11.2023;1.00 Mio CHF;;;1;Wohnen (bis 2 Wohneinheiten);111;Einfamilienhäuser;410;Schuppen und Hütten;1313;Garagen / Fertiggaragen;;;;;;;;;;;;;;
3257713;Neubau Einfamilienhaus unt integrierte Garage;Aeuelistrasse 6;9443;Widnau;SG;Rheintal;Parz. 1094;Neubau Einfamilienhaus unt integrierte Garage;Baubewilligung erteilt;15.07.2024;Baugesuch eingereicht;09.11.2023;1.47 Mio CHF;Jan 24;Dez 24;1;Wohnen (bis 2 Wohneinheiten);111;Einfamilienhäuser;;;;;;;;;;;;;;;;;;
3258783;Umbau und Energetische Sanierung Einfamilienhaus;Wolfensbergstrasse 20;9452;Hinterforst;SG;Rheintal;Gst. 855;Umbau und Energetische Sanierung Einfamilienhaus;Baubewilligung erteilt;13.03.2024;Baugesuch eingereicht;14.11.2023;0.50 Mio CHF;Apr 24;Okt 24;1;Wohnen (bis 2 Wohneinheiten);111;Einfamilienhäuser;111;Einfamilienhäuser;;;;;;;;;;;;;;;;
3258836;Erweiterung Wohnraum und Ersatz Fenster;Zidler 19;9057;Weissbad;AI;Appenzell I.Rh.;Parz. 1028;Erweiterung Wohnraum und Ersatz Fenster (Unternehmer bestimmt);Baubewilligung erteilt;26.03.2024;Baugesuch eingereicht;14.11.2023;0.25 Mio CHF;;;1;Wohnen (bis 2 Wohneinheiten);111;Einfamilienhäuser;111;Einfamilienhäuser;;;;;;;;;;;;;;;;
3258970;Neubau eines Einfamilienhauses mit Carport;Kleestrasse 15;9470;Buchs SG;SG;Werdenberg;Gst. 2323;Neubau eines Einfamilienhauses mit Carport. Regionale Arbeitsvergabe;Baubewilligung erteilt;10.01.2024;Baugesuch eingereicht;15.11.2023;0.90 Mio CHF;Mär 24;Nov 24;1;Wohnen (bis 2 Wohneinheiten);111;Einfamilienhäuser;1314;Carports und Abstellplätze;;;;;;;;;;;;;;;;
3258980;Umbau/Sanierung und Erweiterung Einfamilienhaus, Anbau Carport;Schönaustrasse 19;8717;Benken SG;SG;See-Gaster;Gst. 865;Umbau/Sanierung und Erweiterung Einfamilienhaus, Anbau Carport;Baubewilligung erteilt;27.02.2024;Baugesuch eingereicht;15.11.2023;0.60 Mio CHF;19.02.2024;;1;Wohnen (bis 2 Wohneinheiten);111;Einfamilienhäuser;111;Einfamilienhäuser;111;Einfamilienhäuser;1314;Carports und Abstellplätze;;;;;;;;;;;;
3259125;Umbau und Erweiterung Einfamilienhaus;Seeblickstrasse 7;9037;Speicherschwendi;AR;Mittelland;Gst. 881;Umbau und Erweiterung Einfamilienhaus mit Carport;Baubewilligung erteilt;31.01.2024;Baugesuch eingereicht;16.11.2023;0.45 Mio CHF;;;1;Wohnen (bis 2 Wohneinheiten);111;Einfamilienhäuser;111;Einfamilienhäuser;1314;Carports und Abstellplätze;;;;;;;;;;;;;;
3259126;Umbau/Aufstockung Einfamilienhaus;Sägli 27;9042;Speicher;AR;Mittelland;Gst. 1035;Umbau und Aufstockung Einfamilienhaus mit PV-Anlage;Baubewilligung erteilt;31.01.2024;Baugesuch eingereicht;16.11.2023;0.30 Mio CHF;;;1;Wohnen (bis 2 Wohneinheiten);111;Einfamilienhäuser;111;Einfamilienhäuser;;;;;;;;;;;;;;;;
3259858;Neubau Einfamilienhaus mit angebauter Garage;Paracelsus-Strasse;7310;Bad Ragaz;SG;Sarganserland;Parz. 2256;Neubau Einfamilienhaus mit angebauter Garage regionale Arbeitsvergabe.;Baubewilligung erteilt;19.03.2024;Baugesuch eingereicht;18.11.2023;0.72 Mio CHF;;;1;Wohnen (bis 2 Wohneinheiten);111;Einfamilienhäuser;1313;Garagen / Fertiggaragen;;;;;;;;;;;;;;;;
