ObjektNr;Objektname;Baustelle;BaustPLZ;BaustOrt;BaustKanton;BaustBezirk;ReferenzNr;Kurzbeschreibung;Baustadium;BaustadiumDatum;BaustadiumAlt;BaustadiumDatumAlt;Baukosten;Baubeginn;Bauende;AnzWhg;Hauptkategorie;KatCode01;KatText01;KatCode02;KatText02;KatCode03;KatText03;KatCode04;KatText04;KatCode05;KatText05;KatCode06;KatText06;KatCode07;KatText07;KatCode08;KatText08;KatCode09;KatText09;KatCode10;KatText10
3256452;Umnutzung Geschäftshaus zu Zweifamilienhaus;Erikastrasse 1;9470;Buchs SG;SG;Werdenberg;Parz. 938;Umnutzung Geschäftshaus zu Zweifamilienhaus;Baubewilligung erteilt;05.12.2023;Baugesuch eingereicht;02.11.2023;0.10 Mio CHF;;;2;Wohnen (bis 2 Wohneinheiten);111;Einfamilienhäuser;;;;;;;;;;;;;;;;;;
3257208;Renovation und Umnutzung Zweifamilienhaus in Einfamilienhaus;Alpsteinstrasse 8;9444;Diepoldsau;SG;Rheintal;Parz. 1018;Renovation und Umnutzung Zweifamilienhaus in Einfamilienhaus;Baubewilligung erteilt;13.12.2023;Baugesuch eingereicht;06.11.2023;0.20 Mio CHF;;;2;Wohnen (bis 2 Wohneinheiten);111;Einfamilienhäuser;111;Einfamilienhäuser;;;;;;;;;;;;;;;;
3257539;Umbau Wohnhaus und Scheune mit Einbau Einliegerwohnung, Einbau Garage;Muschnittstrasse;8896;Flumserberg Bergheim;SG;Sarganserland;Parz. 1106;Umbau Wohnhaus und Scheune mit Einbau Einliegerwohnung, Einbau Garage (L-Zone);Baubewilligung erteilt;07.03.2024;Baugesuch eingereicht;08.11.2023;0.95 Mio CHF;;;2;Wohnen (bis 2 Wohneinheiten);111;Einfamilienhäuser;111;Einfamilienhäuser;116;Wohnungen;1313;Garagen / Fertiggaragen;;;;;;;;;;;;
3257710;Neubau Einfamilienhaus mit Einliegerwohnung, integrierte Garage und Carport;Lindenweg;8872;Weesen;SG;See-Gaster;Parz. 223;Neubau Einfamilienhaus mit Einliegerwohnung, integrierte Garage und Carport;Baubewilligung erteilt;26.02.2024;Baugesuch eingereicht;09.11.2023;1.47 Mio CHF;;;2;Wohnen (bis 2 Wohneinheiten);111;Einfamilienhäuser;1314;Carports und Abstellplätze;;;;;;;;;;;;;;;;
3260460;Neubau Zweifamilienhaus mit Tiefgarage;Alpsteinstrasse 14;9050;Appenzell;AI;Appenzell I.Rh.;Parz. 1679;Neubau Zweifamilienhaus mit Tiefgarage;Baubewilligung erteilt;23.05.2024;Baugesuch eingereicht;22.11.2023;1.30 Mio CHF;Anfangs Oktober 2024;Mär 26;2;Wohnen (bis 2 Wohneinheiten);111;Einfamilienhäuser;1312;Tiefgaragen und Unterniveaugaragen;;;;;;;;;;;;;;;;
3261572;Neubau Zweifamilienhaus und integrierte Garage;Hörenstrasse 44;9113;Degersheim;SG;Wil;Parz. 1490;Neubau Zweifamilienhaus und integrierte Garage (Hanglage/Unternehmer bestimmt);Baubewilligung erteilt;13.05.2024;Baugesuch eingereicht;27.11.2023;1.50 Mio CHF;ca. Anfang Jahr 2025;;2;Wohnen (bis 2 Wohneinheiten);111;Einfamilienhäuser;;;;;;;;;;;;;;;;;;
3264556;Umbau Einfamilienhaus zu Zweifamilienhaus;Neugrüttstrase 1c;9436;Balgach;SG;Rheintal;Parz. 2398;Umbau Einfamilienhaus zu Zweifamilienhaus;Baubewilligung erteilt;15.02.2024;Baugesuch eingereicht;11.12.2023;0.04 Mio CHF;;;2;Wohnen (bis 2 Wohneinheiten);111;Einfamilienhäuser;;;;;;;;;;;;;;;;;;
3264616;Neubau 2 Einfamilienhäuser mit 2 Garagen;Im Hebler 13, 13a;9450;Altstätten SG;SG;Rheintal;Parz. 3104;Neubau 2 Einfamilienhäuser mit 2 Garagen;Baubewilligung erteilt;08.02.2024;Baugesuch eingereicht;11.12.2023;1.50-2.00 Mio CHF;;;2;Wohnen (bis 2 Wohneinheiten);111;Einfamilienhäuser;1313;Garagen / Fertiggaragen;;;;;;;;;;;;;;;;
3265993;Umbau und Sanierung Einfamilienhaus in ein Zweifamilienhaus;Sonnenberg 24;9030;Abtwil SG;SG;St. Gallen;Parz. 297;Umbau und Sanierung Einfamilienhaus in ein Zweifamilienhaus;Baubewilligung erteilt;11.07.2024;Baugesuch eingereicht;18.12.2023;1.50 Mio CHF;;;2;Wohnen (bis 2 Wohneinheiten);111;Einfamilienhäuser;111;Einfamilienhäuser;;;;;;;;;;;;;;;;
3266260;Umbau und Sanierung Mehrfamilienhaus;Enggenhüttenstrasse 4a;9050;Appenzell;AI;Appenzell I.Rh.;Parz. 400;Umbau und Sanierung Mehrfamilienhaus;Baubewilligung erteilt;27.02.2024;Baugesuch eingereicht;20.12.2023;0.80 Mio CHF;;;2;Wohnen (ab 3 Wohneinheiten);120;Mehrfamilienhäuser;120;Mehrfamilienhäuser;116;Wohnungen;;;;;;;;;;;;;;
3266265;Umbau und Erweiterung Bauernhaus;Leimensteigstrasse 4;9054;Haslen AI;AI;Appenzell I.Rh.;Parz. 135;Sanierung, Umbau und Erweiterung Bauernhaus (L-Zone);Baubewilligung erteilt;18.03.2024;Baugesuch eingereicht;20.12.2023;nicht veröffentlicht;;;2;Wohnen (bis 2 Wohneinheiten);115;Bauernhäuser;115;Bauernhäuser;116;Wohnungen;;;;;;;;;;;;;;
3266566;Neubau Doppeleinfamilienhaus mit angebaute Garagen;Blumenstrasse 5;9442;Berneck;SG;Rheintal;Parz. 733;Neubau Doppeleinfamilienhaus mit angebaute Garagen;Baubewilligung erteilt;10.10.2024;Baugesuch eingereicht;21.12.2023;1.80 Mio CHF;Anfang Jahr 2025;;2;Wohnen (bis 2 Wohneinheiten);112;Doppel-Einfamilienhäuser;1313;Garagen / Fertiggaragen;;;;;;;;;;;;;;;;
3266879;Neubau Mehrfamilienhaus mit Tiefgaragenteil;Kobelstrasse 2d;9434;Au SG;SG;Rheintal;Parz. 1997;Neubau Mehrfamilienhaus mit Tiefgarageneil;Baubewilligung erteilt;05.07.2024;Baugesuch eingereicht;22.12.2023;1.90 Mio CHF;Feb 25;Feb 26;2;Wohnen (ab 3 Wohneinheiten);120;Mehrfamilienhäuser;1312;Tiefgaragen und Unterniveaugaragen;;;;;;;;;;;;;;;;
3266886;Neubau Einfamilienhaus mit Einliegerwohnung;Bruedermäl 938;9473;Gams;SG;Werdenberg;Parz. 479;Neubau Einfamilienhaus mit Einliegerwohnung;Baubewilligung erteilt;12.03.2024;Baugesuch eingereicht;22.12.2023;0.79 Mio CHF;Sommer 2024;Feb 25;2;Wohnen (bis 2 Wohneinheiten);111;Einfamilienhäuser;;;;;;;;;;;;;;;;;;
3267603;Wärmetechnische Steildachsanierung bei Zweifamilienhaus;Grofisstrasse 23;7324;Vilters;SG;Sarganserland;Parz. 4716;Wärmetechnische Steildachsanierung bei Zweifamilienhaus;Baubewilligung erteilt;01.02.2024;Baugesuch eingereicht;03.01.2024;0.10 Mio CHF;;;2;Wohnen (bis 2 Wohneinheiten);111;Einfamilienhäuser;;;;;;;;;;;;;;;;;;
3269081;Neubau Doppeleinfamilienhaus mit integrierter Garage;Möttelistrasse 2, 2a;9403;Goldach;SG;Rorschach;Parz. 1322;Neubau Doppeleinfamilienhaus mit integrierter Garage;Baubewilligung erteilt;11.03.2024;Baugesuch eingereicht;11.01.2024;2.60 Mio CHF;Jul 24;;2;Wohnen (bis 2 Wohneinheiten);112;Doppel-Einfamilienhäuser;;;;;;;;;;;;;;;;;;
3270334;Neubau Doppel-Einfamilienhaus mit integrierte Garage;Ahornstrasse 7a, 7b;8735;St. Gallenkappel;SG;See-Gaster;Gst. 1120, 1121;Neubau Doppel-Einfamilienhaus mit integrierte Garage (Unternehmer bestimmt/wünschen keine Offertanfragen);Baubewilligung erteilt;02.05.2024;Baugesuch eingereicht;17.01.2024;2.20 Mio CHF;Aug 24;Jul 25;2;Wohnen (bis 2 Wohneinheiten);112;Doppel-Einfamilienhäuser;;;;;;;;;;;;;;;;;;
3271632;Umbau und Sanierung Wohn-/Restaurant in Zweifamilienhaus;Thalerstrasse;9422;Staad SG;SG;Rorschach;Gst. 253;Umbau und Sanierung Wohn-/Restaurant in Zweifamilienhaus (Unternehmer bestimmt/wünschen keine Offertanfragen);Baubewilligung erteilt;08.08.2024;Baugesuch eingereicht;22.01.2024;0.70-0.80 Mio CHF;12.08.2024;Frühling 2025;2;Wohnen (bis 2 Wohneinheiten);111;Einfamilienhäuser;111;Einfamilienhäuser;;;;;;;;;;;;;;;;
3271814;Dachsanierung und Einbau 3 Dachfenster bei Wohnhaus;Bachstrasse 83 / Am Bach;8887;Mels;SG;Sarganserland;Parz. 3370;Dachsanierung und Einbau 3 Dachfenster bei Wohnhaus;Baubewilligung erteilt;02.03.2024;Baugesuch eingereicht;24.01.2024;0.10 Mio CHF;;;2;Wohnen (bis 2 Wohneinheiten);111;Einfamilienhäuser;111;Einfamilienhäuser;;;;;;;;;;;;;;;;
3273668;Ersatzbau Einfamilienhaus mit Einliegerwohnung und Doppelgarage;Berg 109;9622;Krinau;SG;Toggenburg;Gst. 68;Ersatzbau Einfamilienhaus mit Einliegerwohnung und Doppelgarage;Baubewilligung erteilt;17.07.2024;Baugesuch eingereicht;01.02.2024;0.90 Mio CHF;;;2;Wohnen (bis 2 Wohneinheiten);111;Einfamilienhäuser;1313;Garagen / Fertiggaragen;;;;;;;;;;;;;;;;
3273713;Umbau und Sanierung Einfamilienhaus mit Einliegerwohnung;Wigetshof 436;9621;Oberhelfenschwil;SG;Toggenburg;Gst. 3590;Umbau und Sanierung Einfamilienhaus mit Einliegerwohnung;Baubewilligung erteilt;30.05.2024;Baugesuch eingereicht;01.02.2024;0.50 Mio CHF;;;2;Wohnen (bis 2 Wohneinheiten);111;Einfamilienhäuser;111;Einfamilienhäuser;;;;;;;;;;;;;;;;
3275709;Erweiterung und Sanierung Wohnungen;Auboden 562;9125;Brunnadern;SG;Toggenburg;Gst. 1129;Erweiterung und Sanierung Wohnungen (Projektänderung);Baubewilligung erteilt;18.04.2024;Baugesuch eingereicht;05.02.2024;0.40 Mio CHF;11.03.2024;Sep 24;2;Wohnen (bis 2 Wohneinheiten);111;Einfamilienhäuser;111;Einfamilienhäuser;;;;;;;;;;;;;;;;
3275710;Umbau und Sanierung Zweifamilienhaus;Höchster Strasse 30;9016;St. Gallen;SG;St. Gallen;GB 5468;Umbau und Sanierung Zweifamilienhaus (L-Zone);Baubewilligung erteilt;13.03.2024;Baugesuch eingereicht;07.02.2024;0.45 Mio CHF;Aug 24;Nov 24;2;Wohnen (bis 2 Wohneinheiten);111;Einfamilienhäuser;111;Einfamilienhäuser;;;;;;;;;;;;;;;;
3275713;Umbau und Sanierung Zweifamillienhaus;Plattenstrasse 1;7312;Pfäfers;SG;Sarganserland;Gst. 1681;Umbau und Sanierung Zweifamillienhaus;Baubewilligung erteilt;06.06.2024;Baugesuch eingereicht;05.02.2024;0.50 Mio CHF;;;2;Wohnen (bis 2 Wohneinheiten);111;Einfamilienhäuser;111;Einfamilienhäuser;;;;;;;;;;;;;;;;
3275719;Neubau Zweifamilienhaus mit Carport;Flurstrasse 9;9030;Abtwil SG;SG;St. Gallen;Gst. 1370;Neubau Zweifamilienhaus mit Carport (Unternehmer bestimmt);Baubewilligung erteilt;17.05.2024;Baugesuch eingereicht;05.02.2024;1.80 Mio CHF;Mai 2024 (bereits erfolgt);;2;Wohnen (bis 2 Wohneinheiten);111;Einfamilienhäuser;1314;Carports und Abstellplätze;;;;;;;;;;;;;;;;
3275882;Neubau Einfamililienhaus mit Carport und angebaute Garage;Feldweg 6;9621;Oberhelfenschwil;SG;Toggenburg;Gst. 600;Neubau Einfamililienhaus mit Carport und angebaute Garage;Baubewilligung erteilt;14.06.2024;Baugesuch eingereicht;05.02.2024;1.20 Mio CHF;Jul 24;;2;Wohnen (bis 2 Wohneinheiten);111;Einfamilienhäuser;1313;Garagen / Fertiggaragen;1314;Carports und Abstellplätze;;;;;;;;;;;;;;
3277743;Neubau Doppeleinfamilienhaus mit Garagen;Rüdenstrasse 32;9442;Berneck;SG;Rheintal;Parz. 2233;Neubau Doppeleinfamilienhaus mit Garagen;Baubewilligung erteilt;01.05.2024;Baugesuch eingereicht;20.02.2024;3.06 Mio CHF;Anfangs Juni 2024;;2;Wohnen (bis 2 Wohneinheiten);112;Doppel-Einfamilienhäuser;1313;Garagen / Fertiggaragen;;;;;;;;;;;;;;;;
3278141;Umbau Gewerberaum und Umnutzung zum Wohnen;Neustadtstrasse 19;9400;Rorschach;SG;Rorschach;Parz. 835;Umbau Gewerberaum und Umnutzung zum Wohnen;Baubewilligung erteilt;16.05.2024;Baugesuch eingereicht;22.02.2024;0.20 Mio CHF;;;2;Wohnen (bis 2 Wohneinheiten);111;Einfamilienhäuser;111;Einfamilienhäuser;111;Einfamilienhäuser;380;Betriebs- und Gewerbebauten;;;;;;;;;;;;
3279200;Neubau Zweifamilienhaus mit Tiefgarage;Weiherstrasse 6;9053;Teufen AR;AR;Mittelland;Gst. 1738;Neubau Zweifamilienhaus mit Tiefgarage;Baubewilligung erteilt;31.05.2024;Baugesuch eingereicht;26.02.2024;1.50 Mio CHF;;;2;Wohnen (bis 2 Wohneinheiten);111;Einfamilienhäuser;1313;Garagen / Fertiggaragen;;;;;;;;;;;;;;;;
3279219;Sanierung Wohnung und Teilausbau Scheune in Wohnung;Gähwilerstrasse 35;9533;Kirchberg SG;SG;Toggenburg;Parz. 1047;Sanierung Wohnung und Teilausbau Scheune in Wohnung;Baubewilligung erteilt;13.05.2024;Baugesuch eingereicht;26.02.2024;0.42 Mio CHF;;;2;Wohnen (bis 2 Wohneinheiten);111;Einfamilienhäuser;111;Einfamilienhäuser;;;;;;;;;;;;;;;;
3280348;Umbau / Sanierung Geb. Nr. 1561;Tschudiwiesenstrasse 2;8897;Flumserberg Tannenheim;SG;Sarganserland;Parz. 1217;Umbau / Sanierung Geb. Nr. 1561 (Projektänderung);Baubewilligung erteilt;16.05.2024;Baugesuch eingereicht;08.03.2024;0.15 Mio CHF;;;2;Wohnen (ab 3 Wohneinheiten);120;Mehrfamilienhäuser;120;Mehrfamilienhäuser;;;;;;;;;;;;;;;;
3280779;Umbau Zweifamilienhaus und Aufbau PV-Anlage;Egetenstrasse 11;9470;Werdenberg;SG;Werdenberg;Parz. 2848;Umbau Zweifamilienhaus und Installation Photovoltaikanlage;Baubewilligung erteilt;08.05.2024;Baugesuch eingereicht;04.03.2024;0.50 Mio CHF;Sommer 2024;;2;Wohnen (bis 2 Wohneinheiten);111;Einfamilienhäuser;111;Einfamilienhäuser;;;;;;;;;;;;;;;;
3281909;Ausbau/Erweiterung Garage mit Wohnraumerweiterung;Berg 275;9063;Stein AR;AR;Hinterland;Parz. 885;Ausbau/Erweiterung Garage mit Wohnraumerweiterung (L-Zone);Baubewilligung erteilt;08.05.2024;Baugesuch eingereicht;08.03.2024;0.15 Mio CHF;;;2;Wohnen (bis 2 Wohneinheiten);111;Einfamilienhäuser;111;Einfamilienhäuser;1313;Garagen / Fertiggaragen;;;;;;;;;;;;;;
3282996;Neubau Doppeleinfamilienhaus und integrierte Garage;Nordstrasse 21a;9450;Altstätten SG;SG;Rheintal;Parz. 4054;Neubau Doppeleinfamilienhaus und integrierte Garage;Baubewilligung erteilt;10.07.2024;Baugesuch eingereicht;13.03.2024;1.50 Mio CHF;;;2;Wohnen (bis 2 Wohneinheiten);112;Doppel-Einfamilienhäuser;;;;;;;;;;;;;;;;;;
3283274;Neubau Doppeleinfamilienhaus und integrierte Garage;Steigstrasse 8;9125;Brunnadern;SG;Toggenburg;Parz. 545;Neubau Doppeleinfamilienhaus und integrierte Garage;Baubewilligung erteilt;17.05.2024;Baugesuch eingereicht;14.03.2024;1.08 Mio CHF;;;2;Wohnen (bis 2 Wohneinheiten);112;Doppel-Einfamilienhäuser;;;;;;;;;;;;;;;;;;
3285674;Neubau Zweifamilienhaus und Carport;Unterdorfstrasse 10, 12;9248;Bichwil;SG;Wil;Gst. 721, 722, 723;Neubau Zweifamilienhaus und Carport;Baubewilligung erteilt;22.07.2024;Baugesuch eingereicht;22.03.2024;1.10 Mio CHF;;;2;Wohnen (bis 2 Wohneinheiten);111;Einfamilienhäuser;1314;Carports und Abstellplätze;;;;;;;;;;;;;;;;
3286956;Umbau Attikawohnung in Wohnungen;St. Gallerstrasse 26;9400;Rorschach;SG;Rorschach;Parz. 1684;Umbau Attikawohnung in Wohnungen;Baubewilligung erteilt;16.05.2024;Baugesuch eingereicht;28.03.2024;0.20 Mio CHF;;;2;Wohnen (ab 3 Wohneinheiten);116;Wohnungen;116;Wohnungen;;;;;;;;;;;;;;;;
3287449;Neubau Doppeleinfamilienhaus mit Garagenanbau;Rütihaldestrasse 32, 34;8730;Uznach;SG;See-Gaster;Parz. 1694, 1695;Neubau Doppeleinfamilienhaus mit Garagenanbau;Baubewilligung erteilt;15.10.2024;Baugesuch eingereicht;02.04.2024;1.80 Mio CHF;;;2;Wohnen (bis 2 Wohneinheiten);112;Doppel-Einfamilienhäuser;1313;Garagen / Fertiggaragen;;;;;;;;;;;;;;;;
3288962;Umbau und Sanierung Zweifamilienhaus;Fronackeren 223;9204;Andwil SG;SG;St. Gallen;Parz. 256;Umbau und Sanierung Zweifamilienhaus (im Bau);Baubewilligung erteilt;05.08.2024;Baugesuch eingereicht;09.04.2024;0.40 Mio CHF;Mitte Juli 2024;;2;Wohnen (bis 2 Wohneinheiten);111;Einfamilienhäuser;111;Einfamilienhäuser;;;;;;;;;;;;;;;;
3288969;Umbau Einfamilienhaus mit Anbau Wohnung;Fallweg 6;9479;Oberschan;SG;Werdenberg;Parz. 1321;Umbau Einfamilienhaus mit Anbau Wohnung;Baubewilligung erteilt;22.08.2024;Baugesuch eingereicht;09.04.2024;0.42 Mio CHF;;;2;Wohnen (bis 2 Wohneinheiten);111;Einfamilienhäuser;116;Wohnungen;1313;Garagen / Fertiggaragen;;;;;;;;;;;;;;
3290490;Sanierung Dach bei Zweifamilienhaus mit Installation Photovoltaikanlage;Rosenbergstrasse 12;9533;Kirchberg SG;SG;Toggenburg;Parz. 955;Sanierung Dach bei Zweifamilienhaus mit Installation Photovoltaikanlage;Baubewilligung erteilt;01.08.2024;Baugesuch eingereicht;15.04.2024;0.16 Mio CHF;;;2;Wohnen (bis 2 Wohneinheiten);111;Einfamilienhäuser;111;Einfamilienhäuser;;;;;;;;;;;;;;;;
3293843;Umbau Einfamilienhaus mit Einbau Einliegerwohnung, Anbau Garage;Müselbacherstrasse 6, 6a;9602;Bazenheid;SG;Toggenburg;Parz. 442;Umbau Einfamilienhaus mit Einbau Einliegerwohnung, Anbau Garage;Baubewilligung erteilt;28.05.2024;Baugesuch eingereicht;26.04.2024;0.50 Mio CHF;;;2;Wohnen (bis 2 Wohneinheiten);111;Einfamilienhäuser;111;Einfamilienhäuser;1313;Garagen / Fertiggaragen;;;;;;;;;;;;;;
3293851;Neubau Einfamilienhaus mit Einliegerwohnung und integrierte Garage;Sonnhaldenstrasse 59;8722;Kaltbrunn;SG;See-Gaster;Parz. 1639;Neubau Einfamilienhaus mit Einliegerwohnung und integrierte Garage;Baubewilligung erteilt;13.06.2024;Baugesuch eingereicht;26.04.2024;1.00 Mio CHF;Herbst 2024;;2;Wohnen (bis 2 Wohneinheiten);111;Einfamilienhäuser;;;;;;;;;;;;;;;;;;
3294386;Neubau Doppeleinfamilienhaus und integrierte Garage;Ahornstrasse 5a, 5b;8735;St. Gallenkappel;SG;See-Gaster;Parz. 1118, 1119;Neubau Doppeleinfamilienhaus und integrierte Garage (Unternehmer bestimmt/wünschen keine Offertanfragen);Baubewilligung erteilt;06.06.2024;Baugesuch eingereicht;30.04.2024;2.20 Mio CHF;;;2;Wohnen (bis 2 Wohneinheiten);112;Doppel-Einfamilienhäuser;;;;;;;;;;;;;;;;;;
3294405;Neubau Einfamilienhaus mit Einliegerwohnung und Anbau Garage;Gribweg 3;9475;Sevelen;SG;Werdenberg;Parz. 2779;Neubau Einfamilienhaus mit Einliegerwohnung und Anbau Garage;Baubewilligung erteilt;06.06.2024;Baugesuch - Vorabinfo;30.04.2024;0.70 Mio CHF;;;2;Wohnen (bis 2 Wohneinheiten);111;Einfamilienhäuser;1313;Garagen / Fertiggaragen;;;;;;;;;;;;;;;;
3296314;Umbau Einfamilienhaus in Zweifamilienhaus;Gabreiten;8887;Mels;SG;Sarganserland;Parz. 3718;Umbau Einfamilienhaus in Zweifamilienhaus, Anbau Garagen und Abstellraum;Baubewilligung erteilt;13.06.2024;Baugesuch eingereicht;08.05.2024;1.00 Mio CHF;;;2;Wohnen (bis 2 Wohneinheiten);111;Einfamilienhäuser;111;Einfamilienhäuser;1313;Garagen / Fertiggaragen;;;;;;;;;;;;;;
3296316;Anbau Untergeschoss bei Wohnhaus;Schlossberg 25;9526;Zuckenriet;SG;Wil;Parz. 510, 470;Anbau Untergeschoss bei Wohnhaus (im Bau);Baubewilligung erteilt;29.08.2024;Baugesuch eingereicht;08.05.2024;0.08 Mio CHF;;;2;Wohnen (bis 2 Wohneinheiten);111;Einfamilienhäuser;;;;;;;;;;;;;;;;;;
3296319;Umbau Gewerbegebäude und Aufstockung mit Büro und Wohnungen;Letzistrase 27;9015;St. Gallen;SG;St. Gallen;Parz. W3577;Umbau Gewerbegebäude und Aufstockung mit Büro und Wohnungen, Überdachung Parkplätze;Baubewilligung erteilt;21.08.2024;Baugesuch eingereicht;08.05.2024;0.90 Mio CHF;;;2;Wohnen (ab 3 Wohneinheiten);120;Mehrfamilienhäuser;640;Bürobauten mit erhöhten Anforderungen;1314;Carports und Abstellplätze;;;;;;;;;;;;;;
3297531;Neubau Einfamilienhaus mit Einliegerwohnung;Espenstrasse 49;9630;Wattwil;SG;Toggenburg;Parz. 3354;Neubau Einfamilienhaus mit Einliegerwohnung und Doppelgarage;Baubewilligung erteilt;22.06.2024;Baugesuch eingereicht;15.05.2024;1.00 Mio CHF;;;2;Wohnen (bis 2 Wohneinheiten);111;Einfamilienhäuser;1313;Garagen / Fertiggaragen;;;;;;;;;;;;;;;;
3301698;Nutzungsänderung Gewerbe in Wohnen;Bahnhofstrasse 26;9450;Altstätten SG;SG;Rheintal;Gst. 2834;Nutzungsänderung Gewerbe in Wohnen;Baubewilligung erteilt;10.07.2024;Baugesuch eingereicht;31.05.2024;0.40 Mio CHF;;;2;Wohnen (bis 2 Wohneinheiten);116;Wohnungen;;;;;;;;;;;;;;;;;;
3301876;Neubau Mehrfamilienhaus mit Gewerbe-Praxis und Parkplätzen;Gässli;7324;Vilters;SG;Sarganserland;Parz. 5217;Neubau Mehrfamilienhaus mit Gewerbe-Praxis und Parkplätzen;Baubewilligung erteilt;22.08.2024;Baugesuch eingereicht;03.06.2024;1.80 Mio CHF;Okt 24;Sommer 2025;2;Wohnen (ab 3 Wohneinheiten);120;Mehrfamilienhäuser;380;Betriebs- und Gewerbebauten;1311;Parkplätze;;;;;;;;;;;;;;
3303935;Neubau Doppeleinfamilienhaus mit Doppelgarage;Espenstrase 36;9630;Wattwil;SG;Toggenburg;Parz. 3345;Neubau Doppeleinfamilienhaus mit Doppelgarage;Baubewilligung erteilt;12.09.2024;Baugesuch eingereicht;12.06.2024;0.99 Mio CHF;;;2;Wohnen (bis 2 Wohneinheiten);112;Doppel-Einfamilienhäuser;1313;Garagen / Fertiggaragen;;;;;;;;;;;;;;;;
3305264;Energetische Sanierung bei Wohn- und Gewerbegebäude;Dorfstrasse 25;8873;Amden;SG;See-Gaster;Parz. 78;Energetische Sanierung bei Wohn- und Gewerbegebäude (Unternehmer bestimmt);Baubewilligung erteilt;25.09.2024;Baugesuch eingereicht;17.06.2024;0.20-0.30 Mio CHF;Anfangs Oktober 2024;;2;Wohnen (ab 3 Wohneinheiten);120;Mehrfamilienhäuser;120;Mehrfamilienhäuser;120;Mehrfamilienhäuser;380;Betriebs- und Gewerbebauten;380;Betriebs- und Gewerbebauten;380;Betriebs- und Gewerbebauten;;;;;;;;
3305268;Umbau Ferienhaus;Flubastrasse 16;8898;Flumserberg Tannenbodenalp;SG;Sarganserland;Parz. 2402;Umbau Ferienhaus;Baubewilligung erteilt;04.10.2024;Baugesuch eingereicht;17.06.2024;0.18 Mio CHF;;;2;Wohnen (bis 2 Wohneinheiten);113;Ferienhäuser;;;;;;;;;;;;;;;;;;
3305271;Neubau Zweifamilienhaus und integrierte Garage;Schlössli;8895;Flumserberg Portels;SG;Sarganserland;Parz. 1607;Neubau Zweifamilienhaus und integrierte Garage;Baubewilligung erteilt;20.09.2024;Baugesuch eingereicht;17.06.2024;0.63 Mio CHF;Nov 24;;2;Wohnen (bis 2 Wohneinheiten);111;Einfamilienhäuser;;;;;;;;;;;;;;;;;;
3307185;Energetische Sanierung Renovation Innenräume mit Einbau Wohnungen;St. Peterstrasse 2, 6;9500;Wil SG;SG;Wil;Parz. 628;Energetische Sanierung Renovation Innenräume mit Einbau Wohnungen;Baubewilligung erteilt;23.08.2024;Baugesuch eingereicht;25.06.2024;0.80 Mio CHF;;;2;Wohnen (ab 3 Wohneinheiten);120;Mehrfamilienhäuser;120;Mehrfamilienhäuser;;;;;;;;;;;;;;;;
3307518;Umbau und Sanierung Mehrfamilienhaus;Wäselistrasse 8;9442;Berneck;SG;Rheintal;Parz. 582;Umbau und Sanierung Mehrfamilienhaus;Baubewilligung erteilt;19.08.2024;Baugesuch eingereicht;26.06.2024;0.60 Mio CHF;;;2;Wohnen (ab 3 Wohneinheiten);120;Mehrfamilienhäuser;120;Mehrfamilienhäuser;;;;;;;;;;;;;;;;
3307520;Erweiterung Einfamilienhaus, Abbruch best. Holzschöpfe;Diemrütistrasse 7;8734;Ermenswil;SG;See-Gaster;Parz. 919;Erweiterung Einfamilienhaus,  Abbruch best. Holzschöpfe,;Baubewilligung erteilt;01.10.2024;Baugesuch eingereicht;26.06.2024;0.25 Mio CHF;;;2;Wohnen (bis 2 Wohneinheiten);111;Einfamilienhäuser;111;Einfamilienhäuser;410;Schuppen und Hütten;;;;;;;;;;;;;;
3313706;Fassadensanierung bei Ferienhaus;Untere Anggetlinstrasse 5;8897;Flumserberg Tannenheim;SG;Sarganserland;Parz. 3182;Fassadensanierung bei Ferienhaus;Baubewilligung erteilt;04.10.2024;Baugesuch eingereicht;25.07.2024;0.09 Mio CHF;;;2;Wohnen (bis 2 Wohneinheiten);111;Einfamilienhäuser;;;;;;;;;;;;;;;;;;
3315589;Neubau von zwei Einfamilienhäusern mit integrierte Garagen;Buechbergstrasse 28 / 28a;9425;Thal;SG;Rorschach;Gst.  2467, 3172;Neubau von zwei Einfamilienhäusern mit integrierte Garagen;Baubewilligung erteilt;29.10.2024;Baugesuch eingereicht;06.08.2024;1.50-2.00 Mio CHF;;;2;Wohnen (bis 2 Wohneinheiten);111;Einfamilienhäuser;;;;;;;;;;;;;;;;;;
3315740;Umbau Hauptbau;Hauptgasse 18;9050;Appenzell;AI;Appenzell I.Rh.;Parz. 74;Umbau Hauptbau und Wiederaufbau Anbau (Terrasse);Baubewilligung erteilt;16.10.2024;Baugesuch eingereicht;07.08.2024;0.50 Mio CHF;Frühling 2025;;2;Wohnen (bis 2 Wohneinheiten);111;Einfamilienhäuser;111;Einfamilienhäuser;310;Lagerhallen;610;Ladenbauten;;;;;;;;;;;;
3317007;Umbau Einfamilienhaus in Zweifamilienhaus;Rutlengasse 10a;9413;Oberegg;AI;Appenzell I.Rh.;Parz. 1281;Umbau Einfamilienhaus in Zweifamilienhaus;Baubewilligung erteilt;14.10.2024;Baugesuch eingereicht;14.08.2024;0.15 Mio CHF;;;2;Wohnen (bis 2 Wohneinheiten);111;Einfamilienhäuser;;;;;;;;;;;;;;;;;;
3317515;Umbau Einfamilienhaus und Neubau Einfamilienhaus;Ringstrasse, Feldweg 37;7324;Vilters;SG;Sarganserland;Parz. 4962;Umbau Einfamilienhaus und Neubau Einfamilienhaus;Baubewilligung erteilt;10.10.2024;Baugesuch eingereicht;16.08.2024;0.47 Mio CHF;;;2;Wohnen (bis 2 Wohneinheiten);111;Einfamilienhäuser;111;Einfamilienhäuser;;;;;;;;;;;;;;;;
3317939;Neubau Einfamilienhaus mit Einliegerwohnung und Tiefgarage;Sonnhaldenstrasse 20;8645;Jona;SG;See-Gaster;Gst. 2858J;Neubau Einfamilienhaus mit Einliegerwohnung und Tiefgarage;Baubewilligung erteilt;19.11.2024;Baugesuch eingereicht;19.08.2024;2.10 Mio CHF;Frühjahr 2025;Feb 26;2;Wohnen (bis 2 Wohneinheiten);111;Einfamilienhäuser;1312;Tiefgaragen und Unterniveaugaragen;;;;;;;;;;;;;;;;
3320732;Neubau Zweifamilienhaus und integrierte Garage;Glärnischstrasse 2;9524;Zuzwil SG;SG;Wil;GS 1261;Neubau Zweifamilienhaus und integrierte Garage;Baubewilligung erteilt;08.10.2024;Baugesuch eingereicht;30.08.2024;1.20 Mio CHF;Jan 25;Okt 25;2;Wohnen (bis 2 Wohneinheiten);112;Doppel-Einfamilienhäuser;;;;;;;;;;;;;;;;;;
3322460;Fassadenrenovation bei Zweifamilienhaus;Bahnhofstrasse 4;9122;Mogelsberg;SG;Toggenburg;Gst. 1269;Fassadenrenovation bei Zweifamilienhaus;Baubewilligung erteilt;20.11.2024;Baugesuch eingereicht;09.09.2024;0.10 Mio CHF;;;2;Wohnen (bis 2 Wohneinheiten);111;Einfamilienhäuser;411;Gartenhäuser / Pavillons;1314;Carports und Abstellplätze;;;;;;;;;;;;;;
3324580;Umbau und Sanierung Wohnhaus, Neubau Stützmauer;Alterschwil 1345;9230;Flawil;SG;Wil;Gst. 1467;Umbau und Sanierung Wohnhaus, Neubau Stützmauer;Baubewilligung erteilt;21.11.2024;Baugesuch eingereicht;20.09.2024;0.50 Mio CHF;;;2;Wohnen (bis 2 Wohneinheiten);116;Wohnungen;116;Wohnungen;4310;Stützmauern;;;;;;;;;;;;;;
2863184;Neubau Mehrfamilienhaus mit Tiefgarage;Klösterlistrasse 5;9442;Berneck;SG;Rheintal;Gst. 1882;Neubau Mehrfamilienhaus mit Tiefgarage;Baubewilligung erteilt;01.04.2022;Baugesuch eingereicht;31.07.2017;1.50 Mio CHF;Nov 23;Herbst/Winter 2024;3;Wohnen (ab 3 Wohneinheiten);120;Mehrfamilienhäuser;1270;Aussenanlagen, Kinderspielplätze und Parkanlagen;1312;Tiefgaragen und Unterniveaugaragen;;;;;;;;;;;;;;
2928545;Neubau Mehrfamilienhaus mit Tiefgarage;Fürstenlandstrasse 45;9500;Wil SG;SG;Wil;Parz. 1458;Neubau Mehrfamilienhaus mit Tiefgarage (Projektänderung);Baubewilligung erteilt;08.04.2024;Baugesuch eingereicht;01.10.2018;2.10 Mio CHF;;;3;Wohnen (ab 3 Wohneinheiten);120;Mehrfamilienhäuser;1312;Tiefgaragen und Unterniveaugaragen;;;;;;;;;;;;;;;;
2958372;Neubau Mehrfamilienhaus;Ringstrasse 34;9642;Ebnat-Kappel;SG;Toggenburg;Gst.;Neubau Mehrfamilienhaus (Projektänderung);Baubewilligung erteilt;31.05.2024;Baugesuch eingereicht;08.11.2023;0.80 Mio CHF;;;3;Wohnen (ab 3 Wohneinheiten);120;Mehrfamilienhäuser;;;;;;;;;;;;;;;;;;
3117300;Neubau Mehrfamilienhaus (Hanglage);Wisflegge;9468;Sax;SG;Werdenberg;Parz. 2322, 2433;Neubau Mehrfamilienhaus (Hanglage/neue Publikation / Projektänderung);Baubewilligung erteilt;06.02.2024;Baugesuch eingereicht;28.06.2023;1.20 Mio CHF;;;3;Wohnen (ab 3 Wohneinheiten);120;Mehrfamilienhäuser;;;;;;;;;;;;;;;;;;
3125120;Neubau Mehrfamilienhaus und integrierte Garagen;Hauptstrasse 126;9113;Degersheim;SG;Wil;Parz.;Neubau Mehrfamilienhaus und integrierte Garagen;Baubewilligung erteilt;10.05.2022;Baugesuch eingereicht;10.01.2022;2.50 Mio CHF;Jan 24;;3;Wohnen (ab 3 Wohneinheiten);120;Mehrfamilienhäuser;;;;;;;;;;;;;;;;;;
